objectid,objectnumber,title,displaydate,datebegin,dateend,displaymaker,displayculture,displayperiod,medium,classification,displaygeography,accessionyear,department
107808,2014-120,Écorche—Relief of a Horse (Josephine),modeled: ca. 1882; cast: 1979,1882,1979,"Thomas Eakins, American, 1844–1916",,,Bronze,Sculpture,,2014-01-01,American Art
55773,2008-330,Portrait of Alexander the Great,3rd century B.C.,-300,-201,,"Greek, Ptolemaic",,"Fine-grained white marble, possibly Parian",Sculpture,"Place excavated: Egypt ?, Hermopolis",2008-01-01,"Ancient, Byzantine, and Islamic Art"
24658,y1954-135,Amphoriskos,1st century A.D.,1,99,,,Roman Imperial,Translucent dark blue glass,Glass,Place made: Eastern Mediterranean,1954-01-01,"Ancient, Byzantine, and Islamic Art"
23561,y1947-288,Sleeping Birds and Willow,,0,1947,,Chinese,,Hanging scroll; ink and light colors on silk,Paintings,"Place made: Asia, China",1947-01-01,Asian Art
29507,y1965-203,Statuette of Horus (Harpocrates),,-304,-30,Egyptian,,Ptolemaic,Bronze,Metal,,1965-01-01,"Ancient, Byzantine, and Islamic Art"
29307,y1964-191,"First Snow, North River",,1904,1964,"Leon Kroll, American, 1884–1974",,,Oil on wood panel,Paintings,"Place depicted: United States, New York, New York",1964-01-01,American Art
39912,2000-102,Stele of an unknown banqueter,1st – 2nd century A.D.,0,199,,Roman,,Dark gray marble,Sculpture,Place excavated: Turkey,2000-01-01,"Ancient, Byzantine, and Islamic Art"
36605,1998-388,Square-headed fibula,late 6th century,571,599,,Frankish,,Silver with niello and gilding,Ornament,Place made: Western Europe,1998-01-01,"Ancient, Byzantine, and Islamic Art"
5888,x1946-8,Landscape,,1831,1869,"Thomas Creswick, British, 1811–1869",,,Watercolor,Drawings,,1946-01-01,Prints and Drawings
135676,2019-122,War in Vietnam: gunner on helicopter,"May 23, 1964",1964,1964,"Larry Burrows, British, 1926–1971",,,Gelatin silver print,Photographs,"Place depicted: Asia, Vietnam",2019-01-01,Photography
24311,y1953-35,High Peak and Round Top (Catskill) in Winter,1866,1866,1866,"Charles Herbert Moore, American, 1840–1930",,,Oil on canvas,Paintings,"Place depicted: North America, United States, New York, Catskill Mountains",1953-01-01,American Art
23371,y1950-104,Tomb figure: horseman,early 6th century,500,529,,Chinese,"Period of Disunity, 220–589","Gray earthenware with cream colored slip, red paint",Ceramic,"Place excavated: Asia, China, Henan province, northwest of Loyang Fu",1950-01-01,Asian Art
33384,y1990-66,Plaque: Flying figure carrying an object,ca. 1400,1395,1405,"Embriachi Workshop, Italian, 14th–15th century",,,Bone,Bone,"Place made: Europe, Italy, Venice or Florence",1990-01-01,European Painting and Sculpture 
51273,2006-488,Untitled,1990s,1990,1999,"Toshiko Takaezu, American, 1922–2011",,,Porcelain,Ceramics,"Place made: North America, United States",2006-01-01,Modern and Contemporary Art
18538,x1993-141,"Virgil, Dante, and Petrarch: Study for Lunette, Grand Staircase, Detroit Public Library",1922,1922,1922,"Edwin Howland Blashfield, American, 1848–1936",,,"Charcoal, heightened with white chalk",Drawings,,1993-01-01,Prints and Drawings
42181,y1962-6,Pink Flower,late 17th century,1650,1699,,Mughal,,Opaque watercolor on paper,Manuscripts,,1962-01-01,Asian Art
62505,2011-122,Ring 1,1999,1999,1999,"Peggy Preheim, American, born 1963",,,Silver selenium print,Photographs,"Place made: North America, United States",2011-01-01,Modern and Contemporary Art
36213,PU 8190,Fishing rod and line,before 1894,1850,1894,,Iñupiaq,,Wood and whale bone,Tools / Equipment / Implements,"Place made: North America, United States, Alaska, King Island, North Alaska",,Art of the Ancient Americas
137178,2019-410,Spherical Music,1945,1945,1945,"Albert Urban, American, born Germany, 1909–1959",,,Color screenprint,Prints,"Place made: North America, United States, New York, New York",2019-01-01,Prints and Drawings
137236,2019-443,Abraham Abraham,2012,2012,2012,"Nira Pereg, Israeli, born 1969",,,Video,Time-based works,,2019-01-01,Modern and Contemporary Art
33231,y1990-4,"Ring-shaped vessel (kernos) with three attached jars: horsemen, lyre-player",ca. 600–550 B.C.,-600,-550,,"South Italian, Daunian",,Ceramic,Ceramic,"Place made: Europe, Northern Apulia, Southern Italy",1990-01-01,"Ancient, Byzantine, and Islamic Art"
7236,x1948-1726,Three studies of men in conflict,,1775,1826,"John Flaxman, British, 1755–1826",,,Graphite,Drawings,,1948-01-01,Prints and Drawings
35686,PU 5356,Grease dish in the form of a seal,before 1882,1840,1882,,Northern Northwest Coast,,Wood,Vessels,"Place collected: North America, United States, Southeast Alaska",,Art of the Ancient Americas
35574,PU 5045,Kuhke too-gu (circular mat),before 1882,1870,1882,,Tlingit,,Spruce root twining with grass false embroidery,Textiles,Place collected: North America,,Art of the Ancient Americas
27970,y1959-42,Annunciation to the Shepherds,ca. 1425,1425,1425,"Embriachi Workshop, Italian, 14th–15th century",,,Ivory,Ivories,"Place made: Europe, Italy, Venice or Florence",1959-01-01,European Painting and Sculpture 
21979,y1943-124,Jar,,-4000,-2925,,Egyptian,Predynastic Period,Black porphyry with large white inclusions,Vessels,,1943-01-01,"Ancient, Byzantine, and Islamic Art"
1535,2016-716,Elephants Bathing,,0,0,,Indian,,Opaque watercolor on paper,Paintings,,2016-01-01,Asian Art
135295,2019-83,"Dream Walk, trial proof 5",1977,1977,1977,"Helen Frankenthaler, American, 1928–2011 | Printed and published by Tyler Graphics, Ltd. , Bedford Village, New York, founded 1974",,,Color lithograph on HMP handmade paper,Prints,"Place made: North America, United States, New York, Bedford Village",2019-01-01,Prints and Drawings
8217,x1948-89,Portrait of a woman,,1789,1821,"Henry Edridge, British, 1769–1821",,,Graphite and wash,Drawings,,1948-01-01,Prints and Drawings
33287,y1989-11,Rim-fragment of a bowl with lotus flowers,1550–1291 B.C.,-1550,-1291,,Egyptian,"New Kingdom, 18th Dynasty",Faience,Faience,,1989-01-01,"Ancient, Byzantine, and Islamic Art"
34241,y53,Horizontal Rinceaux,late 15th century,1471,1499,,Italian,,Stone,Architectural Elements,"Place made: Europe, Italy",,European Painting and Sculpture 
19543,y1930-412,Bottle,4th century,300,399,,Roman,,Light blue glass,Glass,Place excavated: Syria,1930-01-01,"Ancient, Byzantine, and Islamic Art"
46877,1996-265,"A Gondolier, Venice",ca. 1835,1830,1840,"John Frederick Lewis, British, 1805–1876",,,Oil on canvas,Paintings,"Place depicted: Europe, Italy, Venice",1996-01-01,European Painting and Sculpture 
137560,2020-128,"New York Times, Thursday, January 2, 1997",1997,1997,1997,"Nicky Nodjoumi, Iranian American, born 1942",,,"Gouache, acrylic, and graphite on newsprint",Paintings,"Place made: North America, United States, New York, New York",2020-01-01,Modern and Contemporary Art
31888,y1974-7,Yas (Yasuo Kuniyoshi),"1929, cast 1973",1929,1929,"Dorothea S. Greenbaum, American, 1893–1986",,,Terracotta,Sculpture,,1974-01-01,American Art
6968,x1948-1640,Study for Mirth and Melancholy,ca. 1788,1783,1793,"George Romney, British, 1734–1802",,,"Pen and black ink, black and gray wash over graphite",Drawings,,1948-01-01,Prints and Drawings
135935,2019-297,Red-and-green painted bowl with fish and water plants,13th century,1200,1299,,Chinese,"Southern Song dynasty, 1127–1279 | Jin dynasty, 1115–1234",Cizhou ware with underglaze cream slip and overglaze enamel,Ceramic,,2019-01-01,Asian Art
19244,y1929-244,"Plate with View near Conway, New Hampshire",,1821,1929,"Wm. Adams & Sons, British | after Thomas Cole, American, 1801–1848",,,Earthenware,Ceramics,"Place made: England, Stoke-Upon-Trent",1929-01-01,European Painting and Sculpture 
137486,2020-54,"New York Times, Saturday, April 13, 1996",1996,1996,1996,"Nicky Nodjoumi, Iranian American, born 1942",,,"Gouache, acrylic, and graphite on newsprint",Paintings,"Place made: North America, United States, New York, New York",2020-01-01,Modern and Contemporary Art
23894,y1950-81,Tomb figure: kneeling figure,early 6th century,500,529,,Chinese,"Period of Disunity, 220–589","Gray earthenware with white slip, red paint",Ceramic,"Place excavated: Asia, China, Henan province, northwest of Loyang Fu",1950-01-01,Asian Art
7035,x1949-230,Joseph Telling his Dream,1638,1638,1638,"Rembrandt van Rijn, Dutch, 1606–1669",,,"Etching, third state, 1638",Prints,,1949-01-01,Prints and Drawings
135747,2019-376,Cylinder seal: goats,ca. 1000–600 B.C.,-1000,-600,,Mesopotamian,Neo Assyrian,Steatite,Seals and Stamps,"Place collected: Asia, Iraq or Syria",2019-01-01,"Ancient, Byzantine, and Islamic Art"
35306,PU 4034,Basket with handle,before 1883,1870,1883,,Makah,,Twined red cedar root and bear grass,Textiles,"Place collected: North America, Cape Flattery",,Art of the Ancient Americas
31525,y1970-120,Massacre of the Innocents,,1597,1640,"school of Peter Paul Rubens, Flemish, 1577–1640 | formerly attributed to Peter Paul Rubens, Flemish, 1577–1640",,,Oil on wood panel,Paintings,,1970-01-01,European Painting and Sculpture 
39552,2000-293 a-b,Black-glazed lidded pyxis,ca. 525 B.C.,-575,-475,,"Greek, Attic",,Ceramic,Ceramic,,2000-01-01,"Ancient, Byzantine, and Islamic Art"
30937,y1968-241,Male head,late 6th century B.C.,-529,-501,,Cypriote,,Limestone,Sculpture,,1968-01-01,"Ancient, Byzantine, and Islamic Art"
7263,x1948-218,"Head of Psyche, study after Psyche in the Temple of Love",1893,1893,1893,"Sir Edward John Poynter, British, 1836–1919",,,Brown Conté crayon,Drawings,,1948-01-01,Prints and Drawings
135957,2019-310,Bowl with russet splashes,,960,1279,,Chinese,"Song dynasty, 960–1279",Cizhou ware; stoneware with black and russet glaze,Ceramic,,2019-01-01,Asian Art
35152,PU 5050,Oval mat,before 1883,1870,1883,,Makah,,Twined red cedar root and bear grass,Textiles,"Place collected: North America, Cape Flattery",,Art of the Ancient Americas
24253,y1952-68,St. Leopold,17th century,1600,1699,,Austrian,,Wood with painted and gilded gesso surface,Sculpture,"Place made: Europe, Austria",1952-01-01,European Painting and Sculpture 
32067,y1973-4,Fragment of jug:  Queen Berenike II in relief,ca. 220 B.C.,-270,-170,,Egyptian,Hellenistic,Faience,Faience,,1973-01-01,"Ancient, Byzantine, and Islamic Art"
38925,2000-431,December Fields,1932,1932,1932,"Charles Ephraim Burchfield, American, 1893–1967",,,"Brush and black ink, watercolor and gouache, with touches of white and black chalk over charcoal",Drawings,,2000-01-01,Prints and Drawings
6507,x1948-1247,Seated female nude,,1877,1947,"Georg Kolbe, German, 1877–1947",,,Black chalk,Drawings,,1948-01-01,Prints and Drawings
36160,PU 8173,Carving of a seal,before 1903,1785,1903,,Eskimo,,Whale bone,Bone,"Place collected: North America, United States, Alaska",,Art of the Ancient Americas
23672,y1948-56,Fragmentary funerary relief: man under an arch,4th–5th century,300,499,,,Early Byzantine,Marble,Architectural Elements,Place made: Eastern Mediterranean,1948-01-01,"Ancient, Byzantine, and Islamic Art"
32116,y1977-70,Judith and Holofernes,17th century,1600,1699,"Antonio Bellucci, Italian, 1654 - 1726",,,Oil on canvas,Paintings,"Place made: Europe, Venice",1977-01-01,European Painting and Sculpture 
81240,2012-90 a-b,Teapot with floral carving,late 19th–early 20th century,1870,1914,"Seifū Yohei III 清風与平, 1851–1914",Japanese,"Meiji period, 1868–1912",Porcelain,Ceramics,"(not assigned): Asia, Japan",2012-01-01,Asian Art
31399,y1969-89,"Pliny the Younger and his Mother at Misenum, 79 A.D.",1785,1785,1785,"Angelica Kauffmann, British, born in Switzerland, 1741–1807",,,"Oil on canvas
",Paintings,"Place depicted: Europe, Golfo di Napoli (Bay of Naples)",1969-01-01,European Painting and Sculpture 
32725,y1983-16,Wall hanging,1975,1975,1975,"Alexander Calder, American, 1898–1976",,,Dyed maguey fiber,Textiles,"Place made: North America, Guatemala",1983-01-01,American Art
45514,PP474,"George Henry Davis, Class of 1886",,1935,1966,"Peter Geoffrey Cook, American, 1915–1992",,,Oil on canvas,Paintings,,,American Art
34061,y31,Five Figures for a Crucifix,,1410,1462,"attributed to Niccolò di Guardiagrele, Italian, ca. 1390–before 1462",,,Silver gilt,Metal,,,"Ancient, Byzantine, and Islamic Art"
44610,2005-35,Amphora Series #8,1990,1990,1990,"Laurence Bach, American, born 1947",,,Gelatin silver print with hand-colored sepia toner,Photographs,"Place made: North America, United States",2005-01-01,Photography
27896,y1956-96,Mercury,1st century A.D.,0,99,,Roman,,Bronze,Metal,,1956-01-01,"Ancient, Byzantine, and Islamic Art"
35125,PU 3942,Portrait mask,before 1885,1850,1885,,probably Haida,,"Wood with blue, red, and black paint",Masks,Place collected: North America,,Art of the Ancient Americas
10293,x1961-19,Seated bishop,,1736,1809,"attributed to Joseph-Marie Vien, French, 1716–1809 | formerly attributed to Eustache Le Sueur, French, 1616–1655",,,"Black, red, and white chalk",Drawings,,1961-01-01,Prints and Drawings
21426,L.1988.62.14,Young Woman in a Round Hat,ca. 1877–79,1877,1879,"Édouard Manet, French, 1832–1883",,,Oil on canvas,Paintings,,,European Painting and Sculpture 
31855,y1973-112,A Young Prince,17th century,1620,1671,"attributed to Gerard Soest, Dutch, ca. 1600–1681",,,Oil on canvas,Paintings,,1973-01-01,European Painting and Sculpture 
33301,y1989-26,Portrait of a man,ca. 180 A.D,130,230,,Roman,Antonine or Severan,"White, finely crystalline marble",Sculpture,,1989-01-01,"Ancient, Byzantine, and Islamic Art"
7246,x1948-1730,Standing and flying figures with child between them,,1775,1826,"John Flaxman, British, 1755–1826",,,Graphite,Drawings,,1948-01-01,Prints and Drawings
137717,2020-361,"Untitled, from the Typology series",2005,2005,2005,"Laylah Ali, American, born 1968",,,Ink and graphite collaged on paper support,Drawings,,2020-01-01,Prints and Drawings
32228,y1987-6,Mosaic pavement: medallions and geometric patterns,late 5th century A.D.,450,499,,Roman,,Stone,Mosaics,"Place excavated: Turkey, near Antioch on the Orontes, Seleucia Pieria",1987-01-01,"Ancient, Byzantine, and Islamic Art"
15922,x1984-356,Small compositional study: study for Latimer Preaching at Paul's Cross,,1812,1871,"Sir George Hayter, British, 1792–1871",,,Graphite,Drawings,,1984-01-01,Prints and Drawings
2422,2016-724,Vessel,,0,0,,,,Glazed ceramic,Ceramic,,2016-01-01,Asian Art
22821,y1946-165,Portrait of a Military Official,early 20th century,1900,1941,"Chae Yongsin  蔡龍臣, workshop, Korean, 1890 - 1941",Korean,"Joseon dynasty, 1392–1910",Hanging scroll; ink and color on paper,Paintings,"Place made: Asia, Korea",1946-01-01,Asian Art
51099,2006-69,"Portrait bust of a young woman, possibly a sister of Caligula",second quarter of the 1st century A.D.,25,49,,Roman,Julio-Claudian,Bronze,Metal,,2006-01-01,"Ancient, Byzantine, and Islamic Art"
7842,x1948-447,"Statue of Saint Sebastian, Church of Santa Maria Assunta di Carignano, Genoa",,1750,1809,"after Pierre Puget, French, 1620–1694 | formerly attributed to Augustin Pajou, French, 1730–1809",,,Red chalk; counterproof,Drawings,"Place depicted: Europe, Italy, Genoa",1948-01-01,Prints and Drawings
36097,PU 7176,Doll,ca. 1900,1895,1905,,Apache,,"Buckskin, linen, yarn, beads, and tin",Sculpture,"Place collected: North America, United States",,Art of the Ancient Americas
27752,y1959-23,Etrusco-Corinthian Alabastron,ca. 575–550 B.C.,-575,-550,,Etruscan,,Ceramic,Ceramic,,1959-01-01,"Ancient, Byzantine, and Islamic Art"
88258,2004-241 a,Entablature fragment,5th century A.D.,400,499,,Late Roman,,Grayish-white marble,Architectural Elements,"Place excavated: Turkey, Daphne-Harbie",2004-01-01,"Ancient, Byzantine, and Islamic Art"
18640,x1993-211,untitled,1993,1993,1993,"illustrations by James Romberger, American, born 1958 | text by David Wojnarowicz, American, 1954–1992",,,Screenprint,Prints,,1993-01-01,Prints and Drawings
6052,x1947-170,"Joachim and the Angels, after woodcut in Life of the Virgin series",16th century,1500,1599,"Andrea Boscoli, Italian, 1550–1607 | after Albrecht Dürer, German, 1471–1528",,,Brown ink with brown wash,Drawings,,1947-01-01,Prints and Drawings
35098,PU 3930,Maskette with copper eyes,before 1882,1850,1882,,Tlingit,,"Wood with red and black paint, and brass overlay",Masks,"Place collected: North America, Xunaa Ḵwáan (Hoonah)",,Art of the Ancient Americas
135819,L.2019.37.2,Ein Kurtz Regiment wie sich zu Zeiten der Pestilentz zu halten sey.,Nuremberg: printed 1533,1533,1533,German,,,,Books,,,Exhibitions
32444,y1981-29,Presentation in the Temple,,1535,1563,"Andrea Schiavone, Italian, ca. 1510–1563",,,Oil on canvas,Paintings,,1981-01-01,European Painting and Sculpture 
23316,y1949-148,View of New York City from New Jersey,1857,1857,1857,"John Henry Hill, American, 1839–1922",,,Oil on canvas,Paintings,"Place depicted: United States, New York, Manhattan, New York",1949-01-01,American Art
17097,x1992-130,untitled,1992,1992,1992,"Gaylen Gerber, American, born 1955",,,Gelatin silver print,Photographs,,1992-01-01,Photography
44620,1995-94,Coffin box timber,10th–13th century,900,1299,,Chinese,"Liao dynasty, 907–1125",Wood and pigment,Funerary Objects,"Place made: Asia, China",1995-01-01,Asian Art
31710,y1978-45,George Washington,ca. 1787,1787,1822,"Attributed to Charles Willson Peale, American, 1741–1827 | Person depicted: George Washington, American, 1732–1799",,,Oil on canvas,Paintings,,1978-01-01,American Art
137127,L.2020.4.72,"Spread from “The Metropolitan and Modern Art,” Life","January 15, 1951",1951,1951,"Nina Leen, American, born Russia, 1909–1995",,,Illustrated periodical,Ephemera,,,Exhibitions
35452,PU 5018,Kuhke too-gu (circular mat),before 1883,1870,1883,,Tlingit,,Spruce root twining with grass false embroidery,Textiles,Place collected: North America,,Art of the Ancient Americas
24391,y1953-44,Madonna from a Nativity group,15th century,1400,1499,,German,,"Wood, gesso, and paint",Sculpture,"Place made: Europe, Germany",1953-01-01,European Painting and Sculpture 
36868,1998-421,Earring,4th–5th century,300,499,,Turkish or Russian,Gothic,Gold inset with garnets,Ornament,,1998-01-01,"Ancient, Byzantine, and Islamic Art"
30184,y1966-2,Untitled - 1965,1965,1965,1965,"Jack Massey, American, born 1925",,,Oil and collage on canvas,Paintings,,1966-01-01,American Art
41979,2003-144,Shitao - Van Gogh PUAM,2002–03,2002,2003,"Zhang Hongtu, born China 1943, active New York",,,Oil on canvas,Paintings,"Place made: Asia, China",2003-01-01,Asian Art
24639,y1954-130,Shepherdess,1633,1633,1633,"Paulus Moreelse, Dutch, 1571–1638",,,Oil on canvas,Paintings,,1954-01-01,European Painting and Sculpture 
29309,y1963-41,Warrior on horseback,,220,265,,Chinese,"Wei dynasty, A.D. 220–265",Gray clay with buff and red slip,Ceramic,"Place made: Asia, China",1963-01-01,Asian Art
6722,x1948-1677.85,"Study for mural: fallen figure with two women, woman weeping, group of women",,1879,1921,"William Strang, British, 1859–1921",,,Graphite,Drawings,,1948-01-01,Prints and Drawings
136972,L.2020.6.4,Telegram to Life editor Daniel Longwell,"November 4, 1936",1936,1936,"Margaret Bourke-White, American, 1904–1971",,,Paper,Photographs,,,Exhibitions
58857,2010-16,Zeide Isaac,2009,2009,2009,"Alejandro Cesarco, Uruguayan, born 1975",,,"16mm film transferred to digi-beta
",Time-based works,,2010-01-01,Modern and Contemporary Art
42710,x1983-111 k,Surface Series from Currents #47,1970,1970,1970,"Robert Rauschenberg, American, 1925–2008",,,Screenprint,Prints,"Place made: North America, United States, New York, New York",1983-01-01,Prints and Drawings
35329,PU 5023,Tarlth (placemat),before 1882,1870,1882,,Tlingit,,Spruce root twining with grass false embroidery,Textiles,Place collected: North America,,Art of the Ancient Americas
135870,2019-266,Landscape of the Body (Epilepsy Test),2011,2011,2011,"LaToya Ruby Frazier, American, born 1982",,,Gelatin silver print,Photographs,,2019-01-01,Photography
20110,y1935-18,Nativity,,1360,1393,"Altichiero, Italian, fl. 1369–before 1393",,,Tempera on poplar wood,Paintings,"Place collected: Europe, Verona",1935-01-01,European Painting and Sculpture 
16033,x1984-427,Portrait of Latimer: Study for Latimer Preaching at Paul's Cross,1852,1852,1852,"Sir George Hayter, British, 1792–1871",,,Graphite and slight brownish wash,Drawings,,1984-01-01,Prints and Drawings
16016,x1984-416,Study for figure of Latimer: The Martyrdom of Ridley and Latimer,,1812,1871,"Sir George Hayter, British, 1792–1871",,,Brown ink,Drawings,,1984-01-01,Prints and Drawings
134597,2020-266,Retablo of Bernabé H. and Catarina V.,1944,1944,1944,Anonymous,,,Oil on metal,Paintings,,2020-01-01,Modern and Contemporary Art
22313,y1943-97,Fragment of a black-figure column krater: trireme,ca. 530–520 B.C.,-530,-520,,"Greek, Attic",,Ceramic,Ceramic,,1943-01-01,"Ancient, Byzantine, and Islamic Art"
28621,y1961-290,Head of a serpent (uraeus),,0,1961,,Egyptian,,Limestone,Sculpture,,1961-01-01,"Ancient, Byzantine, and Islamic Art"
31420,y1970-111,Mask,A.D. 1400–1520,1400,1520,,Aztec,Late Postclassic,"Wood with traces of gesso, gold leaf, and hematite",Masks,"Place made: North America, Mexico, reportedly found in southern Oaxaca, Central Mexico",1970-01-01,Art of the Ancient Americas
137496,2020-64,"New York Times, Sunday, June 16, 1996",1996,1996,1996,"Nicky Nodjoumi, Iranian American, born 1942",,,"Gouache, acrylic, and graphite on newsprint",Paintings,"Place made: North America, United States, New York, New York",2020-01-01,Modern and Contemporary Art
33413,y1990-24,Attachment in the form of a comic mask,1st–2nd century A.D.,1,199,,Roman,,Bronze,Ornament,,1990-01-01,"Ancient, Byzantine, and Islamic Art"
9658,x1958-83,Village,,1923,1992,"John Piper, English, 1903–1992",,,"Brown ink, watercolor, gouache",Drawings,,1958-01-01,Prints and Drawings
135418,2019-75,"Hiding Out Back. Slave Cemetery, Mount Locust Stand and Plantation, Jefferson County, Mississippi","2014, printed 2019",2014,2014,"Jeanine Michna-Bales, American, born 1971",,,Chromogenic print,Photographs,"Place depicted: North America, United States, Mississippi, Mount Locust",2019-01-01,Photography
59116,PU 7408,Human effigy with hunting scene,19th century,1800,1899,,Pueblo,,"Ceramic, black-on-white with buff and orange base",Ceramic,"Place collected: North America, United States, New Mexico, Cochiti Pueblo, Rio Grande",,Art of the Ancient Americas
32361,y1979-9,Spanish Moss,1949,1949,1949,"Leonid Berman, American, 1896–1976",,,Oil on canvas,Paintings,"Place depicted: United States, Florida, Jacksonville",1979-01-01,American Art
135818,L.2019.37.1,"Healing scroll (ma’ero qumät, tälsäm, or yä branna ketab)",ca. 1770-1830,1765,1835,Amhara or Tigriyna maker,,,Colored inks on parchment,Manuscripts,,,Exhibitions
135923,2019-447,Amulet of Harpocrates,301–30 B.C.,-301,-30,,Egyptian,Ptolemaic,Blue faience,Faience,"Place made: Africa, Egypt",2019-01-01,"Ancient, Byzantine, and Islamic Art"
16193,x1984-477,"Dr. Smith Preaching, after John Foxe, Book of Martyrs, 1563",,1812,1871,"Sir George Hayter, British, 1792–1871",,,Graphite covered with tan wash,Drawings,,1984-01-01,Prints and Drawings
135697,2019-255,Miniature figure of mother and child,A.D. 1000–1400,1000,1400,,Ica,Late Intermediate,Ceramic with black slip,Ceramic,"Place made: South America, Peru, South coast",2019-01-01,Art of the Ancient Americas
40841,2002-21,Female votive figurine,7th century B.C.,-700,-601,,Cypriote,,Painted terracotta,Ceramic,,2002-01-01,"Ancient, Byzantine, and Islamic Art"
59497,y1986-46.2,Fragment of thread-decorated bowl,7th–9th century,600,899,,Islamic,,Glass,Glass,,1986-01-01,"Ancient, Byzantine, and Islamic Art"
61358,PU 7328,Bowl,A.D. 1100–1300,1100,1300,,Reserve (?) Black-on-White,,Ceramic with white and black slip,Ceramic,"Place collected: North America, United States, Arizona",,Art of the Ancient Americas
33187,y1989-49,Statuette of a hunchback holding a cockerel,2nd–1st century B.C.,-200,-1,,Greek,Hellenistic,Bronze,Metal,,1989-01-01,"Ancient, Byzantine, and Islamic Art"
32793,y1982-83,Cloth with geometric design,A.D. 400–500,400,500,,Nasca,Early Intermediate,Camelid fiber,Textiles,"Place made: South America, Peru, South coast",1982-01-01,Art of the Ancient Americas
9002,x1952-163,Torso of a man holding a staff in his left hand and gesturing with his right,,1580,1609,"Attributed to Domenico Zampieri (called Domenichino), Italian, 1581–1641",,,Red chalk,Drawings,,1952-01-01,Prints and Drawings
19606,y1934-52 u,Scarab,"1479–332 B.C., possibly 1479–1069 B.C.",-1479,-332,,Canaanite,"New Kingdom to Late Period , 18th-30th Dynasties | not prior to the reign of Thutmose III, possibly New Kingdom","Steatite, with faint traces of red glaze",Faience,,1934-01-01,"Ancient, Byzantine, and Islamic Art"
18296,x1992-250,DNA 5,1992,1992,1992,"Susan Rankaitis, American, born 1949",,,Combined medium photographic monoprint,Photographs,"Place made: North America, United States",1992-01-01,Photography
40000,2001-146,White Patty You Don't Shine,1987–88,1987,1988,"Carrie Mae Weems, American, born 1953",,,Gelatin silver print,Photographs,"Place made: North America, United States",2001-01-01,Photography
45005,2005-51,Statuette of the Tyche of Antioch,1st century B.C.,-100,-1,,Roman,,Bronze,Metal,,2005-01-01,"Ancient, Byzantine, and Islamic Art"
24214,y1954-431,The Battle of the Amazons,,1597,1640,"after Peter Paul Rubens, Flemish, 1577–1640",,,Oil on canvas,Paintings,,1954-01-01,European Painting and Sculpture 
36165,PU 8250,Double barb from fish spear,before 1903,1875,1903,,Iñupiaq,,Bone,Tools / Equipment / Implements,"Place made: North America, United States, Alaska, Port Clarence, North Alaska",,Art of the Ancient Americas
